{
  "record_schema_version": "1",
  "tool_id": "get_system_status",
  "version": "1.0.0",
  "contract_hash": "90e2295d172ba8188d986e4aee9ce9665a8b8e2d6694b8ef4015ef711d820a94",
  "implementation_hash": "6ac7ae58ab08b6cff2ded41c82091d6e727291d1e0d5cad7ae38afb32dec9746",
  "status": "registered",
  "reviewer": "local-owner",
  "reviewed_at": "2026-07-26T08:45:00Z",
  "registered_at": "2026-07-26T08:45:00Z"
}
